Name	Source	ID	Link	Creators	Tags	Creation time	Update time	Latest version	Versions	Number of steps	Tools	EDAM operations	EDAM topics	License	DOI	Projects	Filtered on	To keep
Identification Of The Binding Sites Of The Estrogen Receptor - Qc Mapping	WorkflowHub	1619	https:/workflowhub.eu/workflows/1619?version=1		gtn, galaxy, epigenetics	2025-06-02	2025-06-02	1	1	4	fastqc, trim_galore, bowtie2, bam_to_sam			CC-BY-4.0		Galaxy Training Network	binn* in name	True
Chloroplast-genome-assembly-and-annotation	WorkflowHub	1617	https:/workflowhub.eu/workflows/1617?version=1		assembly, gtn, galaxy	2025-06-02	2025-06-02	1	1	13	bandage_info, nanoplot, prokka, jbrowse, bandage_image, fasta-stats, pilon, flye, bwa_mem			CC-BY-4.0		Galaxy Training Network	annot* in name	True
Identification Of The Binding Sites Of The Estrogen Receptor - Chip Seq	WorkflowHub	1620	https:/workflowhub.eu/workflows/1620?version=1		gtn, galaxy, epigenetics	2025-06-02	2025-06-02	1	1	17	deeptools_bam_compare, macs2_callpeak, deeptools_plot_fingerprint, deeptools_multi_bam_summary, deeptools_compute_gc_bias, deeptools_plot_correlation, deeptools_plot_heatmap, samtools_idxstats, deeptools_compute_matrix, deeptools_bam_coverage			CC-BY-4.0		Galaxy Training Network	binn* in name	True
Identification of the binding sites of the T-cell acute lymphocytic leukemia protein 1 (TAL1)	WorkflowHub	1606	https:/workflowhub.eu/workflows/1606?version=1		gtn, galaxy, epigenetics	2025-06-02	2025-06-02	1	1	57	deeptools_bam_compare, bedtools_intersectbed, macs2_callpeak, fastqc, deeptools_plot_fingerprint, deeptools_multi_bam_summary, bwa, trimmomatic, deeptools_plot_correlation, deeptools_plot_heatmap, samtools_idxstats, deeptools_compute_matrix			CC-BY-4.0		Galaxy Training Network	binn* in name	True
GTN Tutorial: Data manipulation Olympics - all steps and exercises	WorkflowHub	1601	https:/workflowhub.eu/workflows/1601?version=1		gtn, galaxy, introduction	2025-06-02	2025-06-02	1	1	59	Add_a_column1, regexColumn1, tp_split_on_column, Count1, Show beginning1, Cut1, tabular_to_csv, Filter1, datamash_ops, join1, Remove beginning1, tp_cat, wc_gnu, cat1, tp_sort_header_tool, tp_sorted_uniq			CC-BY-4.0		Galaxy Training Network	binn* in description	True
End-to-end EI+ mass spectra prediction workflow using QCxMS	WorkflowHub	1597	https:/workflowhub.eu/workflows/1597?version=1		exposomics, gc-ms, gtn, galaxy, metabolomics, qcxms	2025-06-02	2025-06-02	1	1	14	"openbabel_compound_convert, qcxms_production_run, Remove failed runs
__FILTER_FAILED_DATASETS__, xtb_molecular_optimization, param_value_from_file, qcxms_getres, ctb_im_conformers, tp_cut_tool, tp_cat, split_file_to_collection, qcxms_neutral_run"			MIT		Galaxy Training Network	metap* in tags	True
MSI Workflow: spatial distribution	WorkflowHub	1593	https:/workflowhub.eu/workflows/1593?version=1		gtn, galaxy, metabolomics	2025-06-02	2025-06-02	1	1	8	cardinal_data_exporter, cardinal_filtering, cardinal_spectra_plots, Filter1, cardinal_quality_report, cardinal_mz_images			CC-BY-4.0		Galaxy Training Network	metap* in tags	True
Molecular formula assignment and recalibration with MFAssignR package.	WorkflowHub	1591	https:/workflowhub.eu/workflows/1591?version=1		formulaassignment, gtn, galaxy, metabolomics, noiseestimation, recalibration	2025-06-02	2025-06-02	1	1	9	mfassignr_histnoise, mfassignr_kmdnoise, mfassignr_recallist, mfassignr_mfassign, mfassignr_mfassignCHO, mfassignr_isofiltr, mfassignr_snplot, mfassignr_findRecalSeries, mfassignr_recal			MIT		Galaxy Training Network	metap* in tags	True
Combined workflows for large genome assembly - upgraded	WorkflowHub	1611	https:/workflowhub.eu/workflows/1611?version=1		gtn, galaxy, lg-wf	2025-06-02	2025-06-02	1	1	6				GPL-3.0-or-later		Galaxy Training Network	binn* in name	True
Marine Omics identifying biosynthetic gene clusters	WorkflowHub	1663	https:/workflowhub.eu/workflows/1663?version=1	Marie Jossé	earth-system, gtn, galaxy, marineomics, ocean	2025-06-02	2025-07-28	1	1	5	interproscan, regex1, sanntis_marine, prodigal			CC-BY-4.0	10.48546/workflowhub.workflow.1663.1	Galaxy Training Network, EuroScienceGateway	metap* in description	True
Funannotate	WorkflowHub	1525	https:/workflowhub.eu/workflows/1525?version=1	Anthony Bretaudeau	gtn, galaxy, genome-annotation	2025-06-02	2025-07-28	1	1	9	interproscan, funannotate_predict, funannotate_annotate, jbrowse, aegean_parseval, rna_star, eggnog_mapper, funannotate_compare, busco			GPL-3.0-or-later	10.48546/workflowhub.workflow.1525.1	Galaxy Training Network, EuroScienceGateway	annot* in tags	True
annotation_helixer	WorkflowHub	1500	https:/workflowhub.eu/workflows/1500?version=1	Romane Libouban, Anthony Bretaudeau	gtn, galaxy, genome-annotation	2025-06-02	2025-07-28	1	1	7	gffread, jcvi_gff_stats, omark, jbrowse, helixer, busco			MIT	10.48546/workflowhub.workflow.1500.1	Galaxy Training Network, EuroScienceGateway	annot* in tags	True
Apollo Load Test	WorkflowHub	1554	https:/workflowhub.eu/workflows/1554?version=1	Anthony Bretaudeau, Helena Rasche, Nathan Dunn, Mateo Boudet	gtn, galaxy, genome-annotation	2025-06-02	2025-07-28	1	1	5	iframe, list_organism, jbrowse, create_account, create_or_update			CC-BY-4.0	10.48546/workflowhub.workflow.1554.1	Galaxy Training Network, EuroScienceGateway	annot* in tags	True
Genome annotation with Braker3	WorkflowHub	1509	https:/workflowhub.eu/workflows/1509?version=1	Romane Libouban, Anthony Bretaudeau	augustus, busco, braker3, gtn, galaxy, genemark-et, genomeannotation, jbrowse, annotation pipeline, eukaryotic genome, gene prediction, protein evidence, rna-seq, training	2025-06-02	2025-07-28	1	1	6	gffread, jbrowse, busco, fasta-stats, braker3	Gene prediction, Genome annotation, Read mapping, Sequence alignment, Sequence assembly		MIT	10.48546/workflowhub.workflow.1509.1	Galaxy Training Network, EuroScienceGateway	annot* in tags	True
Comparison of two annotation tools: Helixer and Braker3	WorkflowHub	1746	https:/workflowhub.eu/workflows/1746?version=1	Romane Libouban	busco, braker3, gtn, galaxy, genomeannotation, helixer, jbrowse	2025-06-23	2025-07-28	1	1	9	gffread, omark, jbrowse, braker3, helixer, busco			MIT	10.48546/workflowhub.workflow.1746.1	Galaxy Training Network, EuroScienceGateway	annot* in tags	True
Functional annotation	WorkflowHub	1521	https:/workflowhub.eu/workflows/1521?version=1	Anthony Bretaudeau	gtn, galaxy, genome-annotation	2025-06-02	2025-07-28	1	1	2	eggnog_mapper, interproscan			GPL-3.0-or-later	10.48546/workflowhub.workflow.1521.1	Galaxy Training Network, EuroScienceGateway	annot* in tags	True
RepeatMasker	WorkflowHub	1538	https:/workflowhub.eu/workflows/1538?version=2	Anthony Bretaudeau, Alexandre Cormier, Laura Leroi, Erwan Corre, Stéphanie Robin, Jonathan Kreplak	gtn, galaxy, genome-annotation	2025-07-28	2025-07-28	2	2	2	red, repeatmasker_wrapper			GPL-3.0-or-later	10.48546/workflowhub.workflow.1538.2	Galaxy Training Network, EuroScienceGateway	annot* in tags	True
Unicycler assembly and annotation	WorkflowHub	38	https:/workflowhub.eu/workflows/38?version=1		alignment, annotation, assembly, rnaseq, unicycler, covid-19	2020-06-18	2023-02-13	1	1	21	fastp, unicycler, uniprotxml_downloader, glimmer_build-icm, ncbi_makeblastdb, samtools_fastx, glimmer_knowlegde-based, fasterq_dump, ncbi_blastp_wrapper, antismash, picard_MergeSamFiles, transdecoder, samtool_filter2, hmmer_jackhmmer, bwa_mem, multiqc			Apache-2.0		GalaxyProject SARS-CoV-2	annot* in tags	True
StringTie assembly and annotation	WorkflowHub	39	https:/workflowhub.eu/workflows/39?version=1		alignment, annotation, assembly, rnaseq, stringtie, covid-19	2020-06-18	2023-02-13	1	1	22	fastp, gffread, uniprotxml_downloader, glimmer_build-icm, stringtie, ncbi_makeblastdb, samtools_fastx, glimmer_knowlegde-based, fasterq_dump, stringtie_merge, ncbi_blastp_wrapper, antismash, transdecoder, hmmer_jackhmmer, samtool_filter2, hisat2, bwa_mem, multiqc			Apache-2.0		GalaxyProject SARS-CoV-2	annot* in tags	True
Cheminformatics - XChem combined	WorkflowHub	18	https:/workflowhub.eu/workflows/18?version=1	Tim Dudgeon,  Simon Bray,  Gianmauro Cuccuru,  Björn Grüning,  Rachael Skyner,  Jack Scantlebury,  Susan Leung,  Frank von Delft	covid-19	2020-04-10	2023-01-16	1	1	3				MIT		GalaxyProject SARS-CoV-2	binn* in name	True
Cheminformatics - Active site generation	WorkflowHub	13	https:/workflowhub.eu/workflows/13?version=1	Tim Dudgeon,  Simon Bray,  Gianmauro Cuccuru,  Björn Grüning,  Rachael Skyner,  Jack Scantlebury,  Susan Leung,  Frank von Delft	covid-19	2020-04-10	2023-01-16	1	1	2				MIT		GalaxyProject SARS-CoV-2	binn* in description	True
Cheminformatics - Filter results	WorkflowHub	17	https:/workflowhub.eu/workflows/17?version=1	Tim Dudgeon,  Simon Bray,  Gianmauro Cuccuru,  Björn Grüning,  Rachael Skyner,  Jack Scantlebury,  Susan Leung,  Frank von Delft	covid-19	2020-04-10	2023-01-16	1	1	13				MIT		GalaxyProject SARS-CoV-2	binn* in description	True
Cheminformatics - SuCOS scoring	WorkflowHub	15	https:/workflowhub.eu/workflows/15?version=1	Tim Dudgeon,  Simon Bray,  Gianmauro Cuccuru,  Björn Grüning,  Rachael Skyner,  Jack Scantlebury,  Susan Leung,  Frank von Delft	covid-19	2020-04-10	2023-01-16	1	1	5				MIT		GalaxyProject SARS-CoV-2	binn* in description	True
Cheminformatics - TransFS scoring	WorkflowHub	16	https:/workflowhub.eu/workflows/16?version=1	Tim Dudgeon,  Simon Bray,  Gianmauro Cuccuru,  Björn Grüning,  Rachael Skyner,  Jack Scantlebury,  Susan Leung,  Frank von Delft	covid-19	2020-04-10	2023-01-16	1	1	3				MIT		GalaxyProject SARS-CoV-2	binn* in description	True
Assembly using Tophat2 and annotation	WorkflowHub	40	https:/workflowhub.eu/workflows/40?version=1		alignment, annotation, assembly, rnaseq, tophat2, covid-19	2020-06-18	2023-02-13	1	1	24	cuffquant, uniprotxml_downloader, ncbi_makeblastdb, samtools_fastx, samtool_filter2, hmmer_jackhmmer, bwa_mem, cuffmerge, fastp, gffread, ncbi_blastp_wrapper, cuffdiff, multiqc, fasterq_dump, transdecoder, antismash, glimmer_build-icm, glimmer_knowlegde-based, tophat2, cufflinks			Apache-2.0		GalaxyProject SARS-CoV-2	annot* in tags	True
Assembly using Tophat2 and annotation (alternate)	WorkflowHub	37	https:/workflowhub.eu/workflows/37?version=1		alignment, assembly, galaxy, rnaseq, tophat2, covid-19	2020-06-18	2023-02-13	1	1	19	fastp, gffread, uniprotxml_downloader, glimmer_build-icm, ncbi_makeblastdb, glimmer_knowlegde-based, fasterq_dump, ncbi_blastp_wrapper, transdecoder, antismash, tophat2, cufflinks, hmmer_jackhmmer, multiqc, cuffmerge			Apache-2.0		GalaxyProject SARS-CoV-2	annot* in name	True
Genomics - Recombination and selection analysis	WorkflowHub	10	https:/workflowhub.eu/workflows/10?version=1	Dannon Baker,  Marius van den Beek,  Dave Bouvier,  John Chilton,  Nate Coraor,  Frederik Coppens,  Bert Droesbeke,  Ignacio Eguinoa,  Simon Gladman,  Björn Grüning,  Delphine Larivière,  Gildas Le Corguillé,  Andrew Lonie,  Nicholas Keener,  Sergei Kosakovsky Pond,  Wolfgang Maier,  Anton Nekrutenko,  James Taylor,  Steven Weaver	covid-19	2020-04-10	2023-01-16	1	1	6				MIT		GalaxyProject SARS-CoV-2	binn* in name	True
DUNE: Deep feature extraction by UNet-based Neuroimaging-oriented autoEncoder	WorkflowHub	1809	https:/workflowhub.eu/workflows/1809?version=1	Thomas Barba		2025-07-15	2025-07-15	1	1	0	ANTsX			Apache-2.0	10.48546/workflowhub.workflow.1809.1	Gevaert Lab	binn* in description	True
sqtlseeker2-nf	WorkflowHub	435	https:/workflowhub.eu/workflows/435?version=1	Diego Garrido-Martín, Roderic Guigó	alternative splicing, nextflow, qtl mapping, snps, rna-seq	2023-02-15	2023-02-15	1	1	0				GPL-3.0		Guigó lab	metap* in description	True
Biomarker screening in preeclampsia	WorkflowHub	338	https:/workflowhub.eu/workflows/338?version=1	Marlene Rezk		2022-05-03	2023-02-13	1	1	7	fastq_dump, fastqc, featurecounts, bowtie2, deseq2			CC-BY-4.0	10.48546/workflowhub.workflow.338.1	Gyn Department	metap* in description	True
HP2NET - Framework for Construction of Phylogenetic Networks on High Performance Computing (HPC) Environment	WorkflowHub	703	https:/workflowhub.eu/workflows/703?version=1	Rafael Terra, Diego Carvalho	bioinformatics, hpc, parsl, phylogenetics	2024-01-09	2024-01-18	1	1	0				CC-BY-4.0	10.48546/workflowhub.workflow.703.1	HP2NET - Framework for construction of phylogenetic networks on High Performance Computing (HPC) environment	binn* in description	True
Hecatomb	WorkflowHub	235	https:/workflowhub.eu/workflows/235?version=1	Michael Roach		2021-11-11	2024-05-13	1	1	0				MIT	10.48546/workflowhub.workflow.235.1	HecatombDevelopment	metage* in description	True
Sorting and registration of Terahertz ELBE raw data	WorkflowHub	473	https:/workflowhub.eu/workflows/473?version=1			2023-05-17	2023-06-07	1	1	0				CC-BY-4.0		Helmholtz Scientific Project Workflow Platform	binn* in description	True
EukRecover	WorkflowHub	475	https:/workflowhub.eu/workflows/475?version=1			2023-05-19	2023-05-19	1	1	0				CC-BY-4.0		HoloFood at MGnify	metage* in description	True
MetaGT: A pipeline for de novo assembly of metatranscriptomes with the aid of metagenomic data	WorkflowHub	454	https:/workflowhub.eu/workflows/454?version=1	Andrey Prjibelski, Varsha Kale, Anton Korobeynikov	metagenomics, multi-omics, expression, metatranscriptomics	2023-04-12	2023-04-13	1	1	0				MIT		HoloFood at MGnify	metage* in tags	True
Metagenome and metatranscriptome assembly in CWL	WorkflowHub	474	https:/workflowhub.eu/workflows/474?version=2			2023-06-21	2023-06-21	2	2	0				CC-BY-4.0		HoloFood at MGnify	metage* in name	True
Genetic Design	WorkflowHub	23	https:/workflowhub.eu/workflows/23?version=1	Melchior du Lac	retrosynthesis, genetic design, pathway prediction	2020-05-29	2023-01-16	1	1	7	"
 PartsGenie, 
 LCRGenie, 
 rpOptBioDes, 
 DNAWeaver, 
 extractTaxonomy, 
 rpSelenzyme, 
 rpSBMLtoSBOL"			MIT		IBISBA Workflows	plasmid* in description	True
COVID-19: read pre-processing	WorkflowHub	99	https:/workflowhub.eu/workflows/99?version=1			2021-02-02	2023-02-13	1	1	4	samtool_filter2, trim_galore, bwa_mem, samtools_fastx			Apache-2.0		IBISBA Workflows	metage* in description	True
Pathway Ranker	WorkflowHub	25	https:/workflowhub.eu/workflows/25?version=1	Melchior du Lac	retrosynthesis, synthetic biology, metabolic engineering, pathway design, pathway prediction	2020-05-29	2023-01-16	1	1	12	"
 makeSource, 
 rpReader, 
 rpExtractSink, 
 retropath2, 
 retrorules, 
 rpGlobalScore, 
 rp2paths, 
 rpReport, 
 rpThermo, 
 rpCofactors, 
 rpFBA, 
 rpVisualiser"			MIT		IBISBA Workflows	metap* in tags	True
RetroSynthesis	WorkflowHub	24	https:/workflowhub.eu/workflows/24?version=1	Melchior du Lac	retrosynthesis, synthetic biology, metabolic engineering, pathway design, pathway prediction	2020-05-29	2023-01-16	1	1	7	"
 makeSource, 
 rpReader, 
 rpExtractSink, 
 retropath2, 
 retrorules, 
 rp2paths, 
 rpCofactors"			MIT		IBISBA Workflows	metap* in tags	True
Object tracking using CellProfiler	WorkflowHub	115	https:/workflowhub.eu/workflows/115?version=1		cellprofiler, galaxy, image processing, imaging	2021-03-21	2023-07-03	1	1	12	cp_color_to_gray, cp_identify_primary_objects, cp_common, cp_measure_object_size_shape, cp_tile, cp_overlay_outlines, cp_export_to_spreadsheet, cp_measure_object_intensity, cp_save_images, cp_cellprofiler, unzip, cp_track_objects		Bioimaging, Imaging	Apache-2.0		IBISBA Workflows, Euro-BioImaging	profil* in tags	True
Nucleoli segmentation using CellProfiler (EOSC-Life D6)	WorkflowHub	41	https:/workflowhub.eu/workflows/41?version=2		cellprofiler, galaxy, image processing, imaging	2020-11-03	2023-07-03	2	1	25	cp_measure_granularity, cp_measure_object_size_shape, cp_save_images, cp_image_math, cp_mask_image, cp_measure_image_quality, cp_enhance_or_suppress_features, cp_export_to_spreadsheet, cp_relate_objects, cp_measure_texture, cp_convert_objects_to_image, cp_measure_object_intensity, cp_cellprofiler, cp_gray_to_color, cp_measure_image_area_occupied, cp_identify_primary_objects, cp_display_data_on_image, cp_common, idr_download_by_ids, cp_measure_image_intensity		Bioimaging, Imaging	Apache-2.0		IBISBA Workflows, Euro-BioImaging, EOSC-Life WP3	profil* in tags	True
ECTI Atopic Dermatitis	WorkflowHub	1161	https:/workflowhub.eu/workflows/1161?version=1	Jen-Hung Wang	bioinformatics, image processing	2024-09-11	2024-09-11	1	1	0				CC0-1.0	10.48546/workflowhub.workflow.1161.1	IDUN - Drug Delivery and Sensing	ITS in description	True
scRNA-seq MARS-seq	WorkflowHub	61	https:/workflowhub.eu/workflows/61?version=1	Sergi Sayols	mars-seq, bpipe, groovy, scrna-seq	2020-10-07	2023-01-16	1	1	0				GPL-3.0		IMBforge	binn* in description	True
DNA-seq	WorkflowHub	60	https:/workflowhub.eu/workflows/60?version=1	Sergi Sayols	dna-seq, gatk3, bpipe, groovy	2020-10-07	2023-01-16	1	1	0				GPL-3.0		IMBforge	binn* in description	True
scRNA-seq Smart-seq 2	WorkflowHub	62	https:/workflowhub.eu/workflows/62?version=1	Sergi Sayols	bpipe, groovy, scrna-seq, smart-seq 2	2020-10-07	2023-01-16	1	1	0				GPL-3.0		IMBforge	binn* in description	True
ChIP-seq	WorkflowHub	59	https:/workflowhub.eu/workflows/59?version=1	Sergi Sayols	chip-seq, bpipe, groovy	2020-10-07	2023-01-16	1	1	0				GPL-3.0		IMBforge	binn* in description	True
RNA-Seq	WorkflowHub	58	https:/workflowhub.eu/workflows/58?version=1	Sergi Sayols	bpipe, groovy, rna-seq	2020-10-07	2023-01-16	1	1	0				GPL-3.0		IMBforge	binn* in description	True
Gene similariy anaylsis across physiological systems in IMPC phenotype data	WorkflowHub	460	https:/workflowhub.eu/workflows/460?version=1	Andrea Furlani, Philipp Gormanns	jupyter	2023-04-27	2023-06-16	1	1	0				CC-BY-4.0		INFRAFRONTIER workflows	binn* in description	True
Mouse phenotype similarity analyis	WorkflowHub	461	https:/workflowhub.eu/workflows/461?version=1	Andrea Furlani, Philipp Gormanns		2023-04-27	2023-05-25	1	1	0				CC-BY-4.0		INFRAFRONTIER workflows	binn* in description	True
SNP-Calling Workflow	WorkflowHub	442	https:/workflowhub.eu/workflows/442?version=1		bwa-mem, gatk4, rice, variant calling	2023-03-21	2023-03-21	1	1	0	GATK, BWA			MIT		IRRI Bioinformatics Group	profil* in description	True
CNVand	WorkflowHub	1039	https:/workflowhub.eu/workflows/1039?version=1	Carlos Classen	bioinformatics, cnvkit, copy number variation, magic, snakemake, annotsv	2024-06-10	2024-06-10	1	1	0	Snakemake, CNVkit, AnnotSV	Copy number variation detection, Gene functional annotation	Biomedical science, Copy number variation, Data visualisation	MIT	10.48546/workflowhub.workflow.1039.1	Institute for Human Genetics and Genomic Medicine Aachen	annot* in tags	True
1: Plant virus detection with kraken2 (SE)	WorkflowHub	124	https:/workflowhub.eu/workflows/124?version=1		virology, kraken	2021-06-17	2023-02-13	1	1	3	taxonomy_krona_chart, kraken2, Kraken2Tax			Apache-2.0		Integrated and Urban Plant Pathology Laboratory	metage* in description	True
1: Plant virus detection with kraken2 (PE)	WorkflowHub	101	https:/workflowhub.eu/workflows/101?version=1		virology, kraken	2021-02-04	2023-02-13	1	1	3	taxonomy_krona_chart, kraken2, Kraken2Tax			Apache-2.0		Integrated and Urban Plant Pathology Laboratory	metage* in description	True
dada2/main	WorkflowHub	790	https:/workflowhub.eu/workflows/790?version=3	Matthias Bernt	name:amplicon	2025-03-26	2025-08-18	3	3	14	dada2_removeBimeraDenovo, __UNZIP_COLLECTION__, dada2_plotQualityProfile, dada2_dada, dada2_seqCounts, __APPLY_RULES__, dada2_mergePairs, dada2_filterAndTrim, dada2_assignTaxonomyAddspecies, dada2_learnErrors, dada2_makeSequenceTable			MIT		Intergalactic Workflow Commission (IWC)	amplicon in tags	True
qiime2-II-denoising/IIa-denoising-se	WorkflowHub	892	https:/workflowhub.eu/workflows/892?version=3	Debjyoti Ghosh		2024-11-27	2025-08-18	3	3	4	qiime2__feature_table__summarize, qiime2__feature_table__tabulate_seqs, qiime2__metadata__tabulate, qiime2__dada2__denoise_single			MIT		Intergalactic Workflow Commission (IWC)	amplicon in description	True
clinicalmp-data-interpretation/main	WorkflowHub	1219	https:/workflowhub.eu/workflows/1219?version=1	GalaxyP		2024-11-26	2025-08-18	1	1	6	msstatstmt, unipept, Grep1			CC-BY-4.0		Intergalactic Workflow Commission (IWC)	annot* in description	True
clinicalmp-verification/main	WorkflowHub	1218	https:/workflowhub.eu/workflows/1218?version=1	Pratik Jagtap		2024-11-26	2025-08-18	1	1	19	dbbuilder, uniprotxml_downloader, query_tabular, Cut1, Filter1, Remove beginning1, Grouping1, collapse_dataset, pepquery2, tp_cat, fasta_merge_files_and_filter_unique_sequences			CC-BY-4.0		Intergalactic Workflow Commission (IWC)	metap* in description	True
clinicalmp-database-generation/main	WorkflowHub	1216	https:/workflowhub.eu/workflows/1216?version=1	Subina Mehta		2024-11-23	2025-08-18	1	1	3	metanovo, fasta_merge_files_and_filter_unique_sequences			CC-BY-4.0		Intergalactic Workflow Commission (IWC)	metap* in description	True
clinicalmp-discovery/main	WorkflowHub	1225	https:/workflowhub.eu/workflows/1225?version=1	Subina Mehta		2024-12-10	2025-08-18	1	1	24	fasta_merge_files_and_filter_unique_sequences, filter_tabular, search_gui, query_tabular, Grep1, maxquant, Cut1, peptide_shaker, Filter1, Remove beginning1, Grouping1, msconvert, tp_cat, ident_params, fasta_cli, fasta2tab, dbbuilder			CC-BY-4.0		Intergalactic Workflow Commission (IWC)	metap* in description	True
nanopore-pre-processing/main	WorkflowHub	1061	https:/workflowhub.eu/workflows/1061?version=1	Bérénice Batut, Engy Nasr, Paul Zierep		2024-06-26	2025-08-18	1	1	25	nanoplot, fastp, Add_a_column1, regexColumn1, krakentools_extract_kraken_reads, fastqc, minimap2, porechop, Cut1, collection_column_join, samtools_fastx, kraken2, collapse_dataset, __FILTER_FAILED_DATASETS__, bamtools_split_mapped, Grep1, multiqc			MIT	10.48546/workflowhub.workflow.1061.1	Intergalactic Workflow Commission (IWC)	microbiome in description	True
clinicalmp-quantitation/main	WorkflowHub	1177	https:/workflowhub.eu/workflows/1177?version=1	GalaxyP		2024-10-07	2025-08-18	1	1	7	"extract peptides
Cut1, maxquant, extracting microbial Peptides
Grep1, extracting microbial Proteins
Grep1, Quantified-Proteins
Grouping1, extract proteins
Cut1, Quantified-Peptides
Grouping1"			CC-BY-4.0		Intergalactic Workflow Commission (IWC)	metap* in description	True
generic-variant-calling-wgs-pe/main	WorkflowHub	357	https:/workflowhub.eu/workflows/357?version=1	Anton Nekrutenko	generic, mpxv	2022-06-04	2025-08-18	1	1	12	fastp, samtools_stats, samtools_view, lofreq_filter, snpEff, lofreq_viterbi, snpEff_build_gb, lofreq_call, picard_MarkDuplicates, lofreq_indelqual, bwa_mem, multiqc			MIT		Intergalactic Workflow Commission (IWC)	annot* in description	True
baredsc/baredSC-1d-logNorm	WorkflowHub	615	https:/workflowhub.eu/workflows/615?version=6	Lucille Delisle		2025-03-26	2025-08-18	6	6	3	, baredsc_1d, baredsc_combine_1d			MIT		Intergalactic Workflow Commission (IWC)	binn* in description	True
openms-metaprosip/main	WorkflowHub	613	https:/workflowhub.eu/workflows/613?version=2	Matthias Bernt		2024-06-22	2025-08-18	2	2	8	PeptideIndexer, DecoyDatabase, FeatureFinderMultiplex, IDMapper, FalseDiscoveryRate, MetaProSIP, __SORTLIST__, MSGFPlusAdapter			MIT		Intergalactic Workflow Commission (IWC)	metap* in name	True
consensus-peaks/consensus-peaks-chip-sr	WorkflowHub	561	https:/workflowhub.eu/workflows/561?version=11	Lucille Delisle	chip	2025-02-07	2025-08-18	11	11	17	__EXTRACT_DATASET__, deeptools_bigwig_average, samtools_view, bedtools_intersectbed, wig_to_bigWig, macs2_callpeak, Cut1, Filter1, table_compute, collapse_dataset, param_value_from_file, multiqc, tp_sorted_uniq			MIT		Intergalactic Workflow Commission (IWC)	binn* in description	True
amr_gene_detection/main	WorkflowHub	1049	https:/workflowhub.eu/workflows/1049?version=8	ABRomics None, Pierre Marin, Clea Siguret	abromics, amr, amr-detection, genomics, antibiotic-resistance, antimicrobial resistance, antimicrobial-resistance-genes, bacterial-genomics, fasta	2025-09-18	2025-09-18	8	8	5	tooldistillator, abricate, amrfinderplus, tooldistillator_summarize, staramr_search			GPL-3.0-or-later		Intergalactic Workflow Commission (IWC)	antimicrobial in tags	True
bacterial_genome_annotation/main	WorkflowHub	1050	https:/workflowhub.eu/workflows/1050?version=12	ABRomics None, Pierre Marin, Clea Siguret	abromics, annotation, genomics, bacterial-genomics, fasta, genome-annotation	2025-07-31	2025-08-18	12	12	6	tooldistillator, isescan, bakta, integron_finder, plasmidfinder, tooldistillator_summarize			GPL-3.0-or-later		Intergalactic Workflow Commission (IWC)	annot* in tags	True
brew3r/main	WorkflowHub	1051	https:/workflowhub.eu/workflows/1051?version=2	Lucille Delisle		2024-10-10	2025-08-18	2	2	5	map_param_value, stringtie_merge, stringtie, brew3r_r			GPL-3.0-or-later		Intergalactic Workflow Commission (IWC)	annot* in description	True
taxonomy-profiling-and-visualization-with-krona/main	WorkflowHub	1059	https:/workflowhub.eu/workflows/1059?version=1	Engy Nasr, Bérénice Batut, Paul Zierep		2024-06-26	2025-08-18	1	1	3	taxonomy_krona_chart, kraken2, krakentools_kreport2krona			MIT	10.48546/workflowhub.workflow.1059.1	Intergalactic Workflow Commission (IWC)	profil* in name	True
pseudobulk-worflow-decoupler-edger/main	WorkflowHub	1207	https:/workflowhub.eu/workflows/1207?version=2	Diana Chiang Jurado, Pavankumar Videm, Pablo Moreno		2024-11-22	2025-08-18	2	2	13	column_remove_by_header, tp_replace_in_line, tp_awk_tool, edger, volcanoplot, tp_replace_in_column, collection_element_identifiers, decoupler_pseudobulk, param_value_from_file, split_file_to_collection			CC-BY-4.0		Intergalactic Workflow Commission (IWC)	annot* in description	True
